Task Name,Description,Assignee,Priority,Status,Start Date,Due Date,Tags,Task Type,Time Estimate
Establish Private Team Chat,Create private chat with Micah Rodrigo Nick and Landon for governance coordination. Immediate coordination need,Landon,High,To Do,2025-08-10,2025-08-12,"Communication,Governance-Training",Task,2 hr
RBAC Library Security Assessment,Complete security audit of current RBAC library and document bypass vulnerability. Critical security issue identified,Nick Canino,Critical,To Do,2025-08-09,2025-08-13,"Security,Security-Framework",Task,4 hr
RBAC Library Replacement,Replace vulnerable RBAC library with secure authentication implementation. Fix critical bypass vulnerability. Depends on: RBAC Library Security Assessment,Development Team,Critical,To Do,2025-08-17,2025-08-20,"Security,Security-Framework",Task,24 hr
Multi-IDP Integration Design,Design authentication system supporting Microsoft Google Okta and Auth0. Replace custom authentication. Depends on: RBAC Library Security Assessment,Nick Canino,High,To Do,2025-08-21,2025-08-22,"Security,Security-Framework",Task,12 hr
Microsoft Azure AD Integration,Implement Microsoft Azure AD/Entra ID authentication. Primary IDP support. Depends on: Multi-IDP Integration Design,Development Team,High,To Do,2025-09-03,2025-09-05,"Security,Security-Framework",Task,16 hr
Google Workspace Integration,Implement Google Workspace authentication. Secondary IDP support. Depends on: Microsoft Azure AD Integration,Development Team,Medium,To Do,2025-09-13,2025-09-15,"Security,Security-Framework",Task,12 hr
Okta Integration,Implement Okta enterprise authentication. Enterprise IDP support. Depends on: Google Workspace Integration,Development Team,Medium,To Do,2025-09-24,2025-09-25,"Security,Security-Framework",Task,12 hr
Auth0 Abstraction Layer,Implement Auth0 as abstraction layer for multiple IDPs. IDP management simplification. Depends on: Okta Integration,Development Team,Low,To Do,2025-10-02,2025-10-05,"Security,Security-Framework",Task,20 hr
Penetration Testing - Constituent Manager,Security testing for Maryland State constituent portal module. Client delivery deadline August 15,Nick Canino,Critical,To Do,2025-08-08,2025-08-14,"Security,Client-Deliveries",Task,6 hr
Penetration Testing - Legal Assist,Security testing for Maryland State legal assistance module. Client delivery deadline August 25,Nick Canino,Critical,To Do,2025-08-18,2025-08-24,"Security,Client-Deliveries",Task,6 hr
Penetration Testing - AI EMS,Security testing for Howard County EMS module. Client delivery deadline September 1,Nick Canino,High,To Do,2025-08-24,2025-08-30,"Security,Client-Deliveries",Task,6 hr
Penetration Testing - EDS Module,Security testing for DDOT EDS module. Client delivery deadline September 1,Nick Canino,High,To Do,2025-08-24,2025-08-30,"Security,Client-Deliveries",Task,6 hr
Penetration Testing - AI ASL,Security testing for Howard County ASL module. Client delivery deadline September 15,Nick Canino,High,To Do,2025-09-08,2025-09-14,"Security,Client-Deliveries",Task,6 hr
Document Current Architecture,Create comprehensive documentation of existing microservices architecture. Foundation for all architectural decisions,Rodrigo Werlang,High,To Do,2025-08-07,2025-08-15,"Architecture,Architecture-Standardization",Task,8 hr
Database Consolidation Plan,Create plan to consolidate from SQL/Cosmos/MongoDB to standardized stack. Cost and maintenance optimization. Depends on: Document Current Architecture,Rodrigo Werlang,Medium,To Do,2025-08-19,2025-08-25,"Architecture,Architecture-Standardization",Task,6 hr
Python Backend Standardization,Enforce Python-only backend development standard across teams. Technology stack consolidation,Rodrigo Werlang,Medium,To Do,2025-08-16,2025-08-20,"Architecture,Architecture-Standardization",Task,4 hr
C4 Architecture Documentation,Implement C4 model for architecture documentation across all modules. Standardized architecture documentation. Depends on: Document Current Architecture,Rodrigo Werlang,Medium,To Do,2025-08-26,2025-09-15,"Architecture,Architecture-Standardization",Task,20 hr
Kubernetes Deployment Standardization,Standardize K8s deployment configurations across all services. Cloud-agnostic deployment strategy. Depends on: Database Consolidation Plan,Rodrigo Werlang,Medium,To Do,2025-09-14,2025-09-30,"Architecture,Architecture-Standardization",Task,16 hr
Database Migration Execution,Execute database consolidation migration. Technology stack simplification. Depends on: Database Consolidation Plan,Development Team,High,To Do,2025-09-20,2025-10-01,"Architecture,Architecture-Standardization",Task,32 hr
License Management System Design,Design API-based system for customer license control and usage limits. Required for client scaling and billing,Rodrigo Werlang,High,To Do,2025-08-12,2025-08-22,"Compliance,License-Compliance",Task,10 hr
License API Development,Develop API endpoints for license management and control. Customer billing integration. Depends on: License Management System Design,Development Team,High,To Do,2025-08-22,2025-09-01,"Compliance,License-Compliance",Task,16 hr
Usage Monitoring Implementation,Implement usage tracking for license limit enforcement. Billing and compliance tracking. Depends on: License API Development,Development Team,Medium,To Do,2025-08-29,2025-09-10,"Compliance,License-Compliance",Task,12 hr
CISO Assistant Deployment,Deploy and configure CISO Assistant for GRC management. Open source GRC tool implementation,Nick Canino,Medium,To Do,2025-08-22,2025-08-30,"Compliance,License-Compliance",Task,8 hr
Vulnerability Remediation Policy,Create formal policy and procedures for vulnerability management. Required for enterprise clients,Nick Canino,Medium,To Do,2025-08-31,2025-09-05,"Compliance,License-Compliance",Task,4 hr
Compliance Documentation Package,Create comprehensive compliance documentation for enterprise clients. Enterprise sales enablement. Depends on: Vulnerability Remediation Policy,Nick Canino,High,To Do,2025-09-25,2025-10-15,"Compliance,License-Compliance",Task,20 hr
Security Development Lifecycle Adoption,Implement Microsoft SDLC practices adapted for ABS development process. Foundation for secure development,Nick Canino,High,To Do,2025-08-16,2025-09-01,"Process,Development-Process",Task,16 hr
Automated Testing Framework,Implement comprehensive automated testing across all modules. Quality assurance automation. Depends on: Security Development Lifecycle Adoption,Development Team,High,To Do,2025-08-31,2025-09-20,"Process,Development-Process",Task,24 hr
Code Quality Gates,Implement automated code quality checks and approval gates. Development process enforcement. Depends on: Automated Testing Framework,Nick Canino,Medium,To Do,2025-09-17,2025-09-25,"Process,Development-Process",Task,8 hr
Security Code Review Process,Implement mandatory security code reviews for all changes. Secure development process. Depends on: Security Development Lifecycle Adoption,Nick Canino,High,To Do,2025-08-26,2025-08-30,"Process,Development-Process",Task,4 hr
Performance Testing Framework,Implement performance testing for all modules. Quality assurance. Depends on: Automated Testing Framework,Development Team,Medium,To Do,2025-09-19,2025-10-05,"Process,Development-Process",Task,16 hr
Load Testing Implementation,Conduct load testing on all client-facing modules. Scalability validation. Depends on: Performance Testing Framework,Development Team,Medium,To Do,2025-10-03,2025-10-15,"Process,Development-Process",Task,12 hr
Manual Process Audit,Audit all current manual processes for automation opportunities. Practice what we preach initiative,Micah Coger,High,To Do,2025-08-13,2025-08-25,"Automation,Process-Automation",Task,12 hr
Process Automation Implementation,Automate identified manual processes using internal tools. Internal efficiency improvement. Depends on: Manual Process Audit,Development Team,Medium,To Do,2025-10-20,2025-11-01,"Automation,Process-Automation",Task,40 hr
Developer Community Tool Package,Package governance tools for developer community deployment. Community enablement. Depends on: Code Quality Gates,Nick Canino,Medium,To Do,2025-11-05,2025-11-15,"Automation,Process-Automation",Task,30 hr
Client Deployment Automation,Automate client deployment processes for scaling. Operational efficiency. Depends on: Kubernetes Deployment Standardization,Rodrigo Werlang,High,To Do,2025-10-10,2025-10-30,"Automation,Process-Automation",Task,20 hr
Certification Course Development,Create certification course for governance tool usage. Knowledge transfer and standardization. Depends on: Developer Community Tool Package,Micah Coger,Medium,To Do,2025-11-11,2025-12-01,"Training,Governance-Training",Task,40 hr
Security Training Program,Develop security awareness training for development team. Team capability building. Depends on: Security Development Lifecycle Adoption,Nick Canino,Medium,To Do,2025-09-14,2025-09-30,"Training,Governance-Training",Task,16 hr
Weekly Governance Review Meetings,Establish weekly governance review meetings with core team. Ongoing coordination and accountability,Micah Coger,High,To Do,2025-08-10,2025-08-12,"Communication,Governance-Training",Task,2 hr
Team Security Clearance Review,Review and update team security clearances for government contracts. Government contract compliance,Micah Coger,Medium,To Do,2025-08-28,2025-09-01,"Compliance,Governance-Training",Task,4 hr
Threat Modeling Workshop,Conduct threat modeling sessions for all major modules. Proactive security design. Depends on: Security Code Review Process,Nick Canino,Medium,To Do,2025-09-04,2025-09-10,"Security,Governance-Training",Task,16 hr
Monitoring and Alerting Setup,Implement comprehensive monitoring and alerting across all services. Operational visibility,Nick Canino,Medium,To Do,2025-09-04,2025-09-20,"Operations,Monitoring-Operations",Task,16 hr
Security Metrics Dashboard,Create dashboard for security metrics and compliance tracking. Security operations visibility. Depends on: Monitoring and Alerting Setup,Nick Canino,Low,To Do,2025-10-03,2025-10-15,"Operations,Monitoring-Operations",Task,12 hr
Backup and Recovery Testing,Implement and test backup/recovery procedures for all systems. Business continuity planning,Nick Canino,Medium,To Do,2025-09-19,2025-10-01,"Operations,Monitoring-Operations",Task,12 hr
Disaster Recovery Planning,Create and test disaster recovery procedures. Business continuity. Depends on: Backup and Recovery Testing,Nick Canino,Medium,To Do,2025-09-28,2025-10-10,"Operations,Monitoring-Operations",Task,12 hr
Security Incident Response Plan,Develop formal security incident response procedures. Security operations. Depends on: Vulnerability Remediation Policy,Nick Canino,High,To Do,2025-09-07,2025-09-15,"Operations,Monitoring-Operations",Task,8 hr
Vendor Security Assessment,Assess security posture of all third-party vendors and dependencies. Supply chain security,Nick Canino,Medium,To Do,2025-09-22,2025-09-30,"Security,Monitoring-Operations",Task,8 hr
Third-Party Security Assessment,Coordinate external security assessment with Accenture requirements. Partnership compliance,Nick Canino,High,To Do,2025-09-27,2025-10-01,"Security,Monitoring-Operations",Task,4 hr
Accenture Technical Review Preparation,Prepare all documentation and systems for Accenture technical review. Partnership milestone. Depends on: Compliance Documentation Package,All Team,Critical,To Do,2025-09-15,2025-10-01,"Review,Monitoring-Operations",Task,16 hr
Monthly Security Assessment Reports,Create monthly security posture reports for leadership. Executive visibility. Depends on: Security Metrics Dashboard,Nick Canino,Medium,To Do,2025-08-28,2025-09-01,"Communication,Monitoring-Operations",Task,4 hr
Quarterly Architecture Reviews,Establish quarterly architecture review process. Continuous improvement. Depends on: C4 Architecture Documentation,Rodrigo Werlang,Medium,To Do,2025-08-28,2025-09-01,"Review,Monitoring-Operations",Task,4 hr
Celery Worker Memory Optimization,Investigate and fix memory consumption issues in Celery workers. Performance optimization,Development Team,Medium,To Do,2025-08-29,2025-09-10,"Implementation,Architecture-Standardization",Task,12 hr
API Gateway Implementation,Implement centralized API gateway for service orchestration. Service mesh architecture. Depends on: Kubernetes Deployment Standardization,Rodrigo Werlang,Medium,To Do,2025-09-25,2025-10-15,"Architecture,Architecture-Standardization",Task,20 hr
Service Mesh Implementation,Implement service mesh for microservices communication. Advanced microservices architecture. Depends on: API Gateway Implementation,Rodrigo Werlang,Low,To Do,2025-10-08,2025-11-01,"Architecture,Architecture-Standardization",Task,24 hr
